{
  "schema_version": "2.0",
  "course_type": "individual",
  "season": "Summer 2026",
  "student": {
    "student_name": "Maya Haddad",
    "student_id": "TP-2026-0114",
    "grade_level": 11,
    "known_foundational_gaps": [
      {
        "lesson_id": "MATH_NONLINEAR_EQ_SYSTEMS",
        "severity": "major",
        "evidence": "Cannot factor quadratics without prompting; memorizes the formula without understanding (teacher intake interview)."
      }
    ],
    "teacher_overrides": [],
    "teacher_flagged_weak_subskills": []
  },
  "scores": {
    "score_source": "provided",
    "reading_writing_scaled": 480,
    "math_scaled": 440,
    "total_scaled": 920
  },
  "goal": {
    "target_sat_score": 1250,
    "intended_test_date": "2026-10-03"
  },
  "availability": {
    "weeks_available": 10,
    "preferred_sessions_per_week": 2,
    "max_session_length": "2 hrs",
    "session_format": "Focused blocks",
    "accommodation": "No"
  },
  "diagnostic": {
    "template_id": "Diagnostic_Exam_2026",
    "date": "July 6, 2026",
    "answers": [
      {
        "section": "english",
        "module": "module_1",
        "question_number": 1,
        "student_answer": "B",
        "correct_answer": "B",
        "time_seconds": 76
      },
      {
        "section": "english",
        "module": "module_1",
        "question_number": 2,
        "student_answer": "A",
        "correct_answer": "A",
        "time_seconds": 45
      },
      {
        "section": "english",
        "module": "module_1",
        "question_number": 3,
        "student_answer": "B",
        "correct_answer": "B",
        "time_seconds": 92
      },
      {
        "section": "english",
        "module": "module_1",
        "question_number": 4,
        "student_answer": "B",
        "correct_answer": "D",
        "time_seconds": 79
      },
      {
        "section": "english",
        "module": "module_1",
        "question_number": 5,
        "student_answer": "D",
        "correct_answer": "D",
        "time_seconds": 48
      },
      {
        "section": "english",
        "module": "module_1",
        "question_number": 6,
        "student_answer": "D",
        "correct_answer": "A",
        "time_seconds": 93
      },
      {
        "section": "english",
        "module": "module_1",
        "question_number": 7,
        "student_answer": "C",
        "correct_answer": "C",
        "time_seconds": 74
      },
      {
        "section": "english",
        "module": "module_1",
        "question_number": 8,
        "student_answer": "A",
        "correct_answer": "B",
        "time_seconds": 52
      },
      {
        "section": "english",
        "module": "module_1",
        "question_number": 9,
        "student_answer": "D",
        "correct_answer": "D",
        "time_seconds": 47
      },
      {
        "section": "english",
        "module": "module_1",
        "question_number": 10,
        "student_answer": "D",
        "correct_answer": "A",
        "time_seconds": 91
      },
      {
        "section": "english",
        "module": "module_1",
        "question_number": 11,
        "student_answer": "A",
        "correct_answer": "C",
        "time_seconds": 82
      },
      {
        "section": "english",
        "module": "module_1",
        "question_number": 12,
        "student_answer": "B",
        "correct_answer": "C",
        "time_seconds": 68
      },
      {
        "section": "english",
        "module": "module_1",
        "question_number": 13,
        "student_answer": "A",
        "correct_answer": "A",
        "time_seconds": 68
      },
      {
        "section": "english",
        "module": "module_1",
        "question_number": 14,
        "student_answer": "A",
        "correct_answer": "A",
        "time_seconds": 77
      },
      {
        "section": "english",
        "module": "module_1",
        "question_number": 15,
        "student_answer": "D",
        "correct_answer": "D",
        "time_seconds": 55
      },
      {
        "section": "english",
        "module": "module_1",
        "question_number": 16,
        "student_answer": "B",
        "correct_answer": "B",
        "time_seconds": 59
      },
      {
        "section": "english",
        "module": "module_1",
        "question_number": 17,
        "student_answer": "A",
        "correct_answer": "B",
        "time_seconds": 54
      },
      {
        "section": "english",
        "module": "module_1",
        "question_number": 18,
        "student_answer": "D",
        "correct_answer": "D",
        "time_seconds": 62
      },
      {
        "section": "english",
        "module": "module_1",
        "question_number": 19,
        "student_answer": "B",
        "correct_answer": "B",
        "time_seconds": 98
      },
      {
        "section": "english",
        "module": "module_1",
        "question_number": 20,
        "student_answer": "D",
        "correct_answer": "A",
        "time_seconds": 68
      },
      {
        "section": "english",
        "module": "module_1",
        "question_number": 21,
        "student_answer": "C",
        "correct_answer": "C",
        "time_seconds": 50
      },
      {
        "section": "english",
        "module": "module_1",
        "question_number": 22,
        "student_answer": "C",
        "correct_answer": "C",
        "time_seconds": 57
      },
      {
        "section": "english",
        "module": "module_1",
        "question_number": 23,
        "student_answer": "A",
        "correct_answer": "C",
        "time_seconds": 55
      },
      {
        "section": "english",
        "module": "module_1",
        "question_number": 24,
        "student_answer": "D",
        "correct_answer": "A",
        "time_seconds": 89
      },
      {
        "section": "english",
        "module": "module_1",
        "question_number": 25,
        "student_answer": "A",
        "correct_answer": "C",
        "time_seconds": 52
      },
      {
        "section": "english",
        "module": "module_1",
        "question_number": 26,
        "student_answer": "A",
        "correct_answer": "A",
        "time_seconds": 80
      },
      {
        "section": "english",
        "module": "module_1",
        "question_number": 27,
        "student_answer": "D",
        "correct_answer": "D",
        "time_seconds": 85
      },
      {
        "section": "english",
        "module": "module_b",
        "question_number": 1,
        "student_answer": "B",
        "correct_answer": "B",
        "time_seconds": 48
      },
      {
        "section": "english",
        "module": "module_b",
        "question_number": 2,
        "student_answer": "C",
        "correct_answer": "D",
        "time_seconds": 53
      },
      {
        "section": "english",
        "module": "module_b",
        "question_number": 3,
        "student_answer": "B",
        "correct_answer": "B",
        "time_seconds": 71
      },
      {
        "section": "english",
        "module": "module_b",
        "question_number": 4,
        "student_answer": "A",
        "correct_answer": "D",
        "time_seconds": 61
      },
      {
        "section": "english",
        "module": "module_b",
        "question_number": 5,
        "student_answer": "C",
        "correct_answer": "C",
        "time_seconds": 66
      },
      {
        "section": "english",
        "module": "module_b",
        "question_number": 6,
        "student_answer": "C",
        "correct_answer": "A",
        "time_seconds": 70
      },
      {
        "section": "english",
        "module": "module_b",
        "question_number": 7,
        "student_answer": "B",
        "correct_answer": "B",
        "time_seconds": 83
      },
      {
        "section": "english",
        "module": "module_b",
        "question_number": 8,
        "student_answer": "C",
        "correct_answer": "C",
        "time_seconds": 56
      },
      {
        "section": "english",
        "module": "module_b",
        "question_number": 9,
        "student_answer": "B",
        "correct_answer": "B",
        "time_seconds": 96
      },
      {
        "section": "english",
        "module": "module_b",
        "question_number": 10,
        "student_answer": "D",
        "correct_answer": "A",
        "time_seconds": 75
      },
      {
        "section": "english",
        "module": "module_b",
        "question_number": 11,
        "student_answer": "D",
        "correct_answer": "D",
        "time_seconds": 58
      },
      {
        "section": "english",
        "module": "module_b",
        "question_number": 12,
        "student_answer": "B",
        "correct_answer": "C",
        "time_seconds": 98
      },
      {
        "section": "english",
        "module": "module_b",
        "question_number": 13,
        "student_answer": "D",
        "correct_answer": "C",
        "time_seconds": 75
      },
      {
        "section": "english",
        "module": "module_b",
        "question_number": 14,
        "student_answer": "C",
        "correct_answer": "C",
        "time_seconds": 62
      },
      {
        "section": "english",
        "module": "module_b",
        "question_number": 15,
        "student_answer": "A",
        "correct_answer": "B",
        "time_seconds": 46
      },
      {
        "section": "english",
        "module": "module_b",
        "question_number": 16,
        "student_answer": "A",
        "correct_answer": "C",
        "time_seconds": 81
      },
      {
        "section": "english",
        "module": "module_b",
        "question_number": 17,
        "student_answer": "A",
        "correct_answer": "B",
        "time_seconds": 72
      },
      {
        "section": "english",
        "module": "module_b",
        "question_number": 18,
        "student_answer": "A",
        "correct_answer": "A",
        "time_seconds": 84
      },
      {
        "section": "english",
        "module": "module_b",